{
 "state_abbrev": "CA",
 "researched_as_of": "2026-09-23",
 "researcher": "Claude coordinator (QA round 5 markers)",
 "decisions": [
  {
   "moratorium_id": "ca-irwindale-undated",
   "outcome": "corrected",
   "confidence": 0.5,
   "changes": {
    "current_status": {
     "from": "Replaced as of 2026-09-23. Whether Draft Urgency Ordinance 819 (the proposed 45-day moratorium) was ever formally adopted at the 2026-05-27 hearing could not be confirmed in this pass either; no news coverage or minutes referencing Ordinance 819's disposition were located. What is confirmed is that the City subsequently directed staff and legal counsel to prepare a permanent prohibition: the City Council unanimously approved Ordinance No. 821, adding Chapter 17.42 (Artificial Intelligence (AI) Data Centers & Associated Uses) to the Irwindale Municipal Code, on first reading 2026-08-26 and second reading/final adoption 2026-09-09; the ordinance takes effect 2026-10-09. This permanent citywide prohibition resolves the pending question regardless of Ordinance 819's status.",
     "to": "Replaced as of 2026-09-23. Whether Draft Urgency Ordinance 819 (the proposed 45-day moratorium) was ever formally adopted at the 2026-05-27 hearing could not be confirmed in this pass either; no news coverage or minutes referencing Ordinance 819's disposition were located. What is confirmed is that the City subsequently directed staff and legal counsel to prepare a permanent prohibition: the City Council unanimously approved Ordinance No. 821, adding Chapter 17.42 (Artificial Intelligence (AI) Data Centers & Associated Uses) to the Irwindale Municipal Code, on first reading 2026-08-26 and second reading/final adoption 2026-09-09; the ordinance takes effect 2026-10-09. This permanent citywide prohibition resolves the pending question regardless of Ordinance 819's status. [VERIFY adoption of Ordinance 819 not confirmed in the 2026-09 QA pass; CivicClerk event has no minutes]",
     "reason": "QA round 5 could not confirm the row's status or adoption; flag it so the next worklist picks it up."
    }
   },
   "evidence": [
    {
     "url": "https://irwindaleca.api.civicclerk.com/v1/Events/1222",
     "title": "City Council Meeting event record, May 27, 2026",
     "publisher": "City of Irwindale (CivicClerk)",
     "document_date": "2026-05-27",
     "source_type": "agenda",
     "supports": "Confirms the May 27, 2026 agenda item for Urgency Ordinance No. 819 but shows no minutesFile was ever uploaded for this event, so the vote outcome cannot be read from the record.",
     "quote": "\"minutesFile\":{\"minutesId\":0,\"eventId\":0,\"fileName\":null"
    },
    {
     "url": "https://irwindaleca.api.civicclerk.com/v1/Meetings/GetMeetingFileStream(fileId=2240,plainText=false)",
     "title": "Agenda Materials - May 27, 2026",
     "publisher": "City of Irwindale",
     "document_date": "2026-05-22",
     "source_type": "agenda",
     "supports": "Confirms Urgency Ordinance No. 819 (temporary data-center moratorium) was agendized as Public Hearing item 21.A for the May 27, 2026 meeting requiring a 4/5 roll-call vote, but the packet contains no minutes or disposition.",
     "quote": "Urgency Ordinance No. 819 To Establish a Temporary Moratorium Prohibiting the Processing of Applications or Approvals For Data Centers ... adopt the ordinance as an urgency measure by a roll call vote with a minimum 4/5 vote"
    },
    {
     "url": "https://www.dailynews.com/2026/09/18/la-county-issues-temporary-ban-on-mega-data-centers-with-ordinance-in-the-works/",
     "title": "LA County issues temporary ban on mega data centers, with ordinance in the works",
     "publisher": "Los Angeles Daily News",
     "document_date": "2026-09-18",
     "source_type": "news",
     "supports": "Regional roundup confirms Irwindale's permanent data-center ban (Ordinance 821) was adopted Sept. 9, 2026, but does not mention Ordinance 819 or its disposition.",
     "quote": "Most recently, the Irwindale City Council unanimously approved a data center ban through an ordinance on Sept. 9, in effect 30 days after adoption."
    },
    {
     "url": "https://www.cleat.ai/government/contracts/ordinance-no-821-to-establish-an-ordinance-adding-chapter-17-42-artificial-intelligence-ai-data-centers-and-associated-uses-to-the-irwindale-municipal-code-fzpj",
     "title": "Ordinance No. 821, to Establish an Ordinance adding Chapter 17.42",
     "publisher": "City of Irwindale (via Cleatus contract tracker)",
     "source_type": "other",
     "supports": "Describes Ordinance 821 as a city-initiated permanent zoning prohibition on AI data centers, with no reference to Ordinance 819.",
     "quote": "Ordinance No. 821 is a city-initiated proposed amendment to the Irwindale Municipal Code designed to establish Chapter 17.42 within Title 17 regarding Zoning."
    }
   ],
   "notes": "Coordinator marker for a row left unresolvable in QA round 5."
  }
 ]
}