{
 "state_abbrev": "FL",
 "researched_as_of": "2026-09-23",
 "researcher": "claude-opus-5.5 QA4-contradictions",
 "decisions": [
  {
   "moratorium_id": "fl-leon-county-undated",
   "outcome": "confirmed_unchanged",
   "confidence": 0.85,
   "evidence": [
    {
     "url": "https://news.wfsu.org/wfsu-local-news/2026-07-14/leon-commissioners-pass-data-center-moratorium-block-flock-camera-grant-funding",
     "source_type": "news",
     "supports": "The 2026-07-14 unanimous vote only began the process; two public hearings were still needed.",
     "publisher": "WFSU",
     "document_date": "2026-07-14",
     "quote": "The commission unanimously voted to begin the process to enact an 18-month moratorium"
    },
    {
     "url": "https://tallahasseereports.com/2026/09/11/leon-county-to-hold-public-hearing-on-18-month-data-center-moratorium/",
     "source_type": "news",
     "supports": "First of two hearings set for 2026-09-15; final hearing recommended for 2026-10-13.",
     "publisher": "Tallahassee Reports",
     "document_date": "2026-09-11"
    },
    {
     "url": "https://fox49.tv/news/local/leon-county-moves-toward-18-month-data-center-moratorium",
     "source_type": "news",
     "supports": "First hearing passed unanimously; final vote scheduled 2026-10-13.",
     "publisher": "FOX 49",
     "quote": "The final moratorium vote is scheduled for Oct. 13"
    },
    {
     "url": "https://www.wctv.tv/2026/07/15/leon-county-commissioners-approved-18-month-data-center-moratorium/",
     "source_type": "news",
     "supports": "The tracker's source; its 'approved' headline describes the July direction to staff, which WFSU and later coverage show was not adoption.",
     "publisher": "WCTV",
     "document_date": "2026-07-15"
    }
   ],
   "notes": "Trackers (savrn, aigridwatch, interconnectedcapital) all misread the 2026-07-14 direction-to-staff vote as adoption, following WCTV's headline. The ordinance needs two hearings: first passed 2026-09-15, final set for 2026-10-13. Our pending is right."
  }
 ]
}