{
 "state_abbrev": "OH",
 "researched_as_of": "2026-09-23",
 "researcher": "claude-opus-5.5 QA4-contradictions",
 "decisions": [
  {
   "moratorium_id": "oh-liberty-township-wood-county-2026",
   "outcome": "confirmed_unchanged",
   "confidence": 0.5,
   "evidence": [
    {
     "url": "https://bgindependentmedia.org/temporary-moratoriums-on-data-centers-7-townships-in-wood-county-have-adopted-8-have-discussed/",
     "source_type": "news",
     "supports": "Liberty Township (Wood County, around Rudolph) is among townships whose trustees approved temporary moratoriums as of 2026-03-13.",
     "publisher": "BG Independent News",
     "document_date": "2026-03-13"
    },
    {
     "url": "https://ohiocapitaljournal.com/2026/09/18/ohio-now-has-over-125-active-moratoriums-on-data-centers-see-where-they-are/",
     "source_type": "news",
     "supports": "The OCJ 'Sept. 3 explicit prohibition' entry is Liberty Township in Knox County (Marta Hill, Knox County Regional Planning Commission), not Wood County.",
     "publisher": "Ohio Capital Journal",
     "document_date": "2026-09-18",
     "quote": "Marta Hill represents Liberty Township at the Knox County Regional Planning Commission ... The township passed a resolution explicitly prohibiting data centers Sept. 3"
    },
    {
     "url": "https://www.woodcountytownships.com/liberty",
     "source_type": "other",
     "supports": "Wood County's Liberty Township (Rudolph) trustees; no zoning prohibition found.",
     "publisher": "Wood County Township Association"
    }
   ],
   "notes": "OCJ is not wrong, but the packet mis-joined it by name: none of its three 'Liberty Township' ban entries is Wood County. The April and June entries cite LUC Regional Planning (Logan-Union-Champaign) and libertytownshipunionco.com (Union County); the September entry is Knox County per OCJ's own text. No ban or replacement was found for Liberty Township, Wood County. The row stays as it is (news-only moratorium; its existing VERIFY tag still applies)."
  },
  {
   "moratorium_id": "oh-monroe-township-adams-county-2026",
   "outcome": "confirmed_unchanged",
   "confidence": 0.6,
   "evidence": [
    {
     "url": "https://www.wlwt.com/article/how-greater-cincinnati-preparing-for-ohio-data-center-boom/71724722",
     "source_type": "news",
     "supports": "The OCJ ban source refers to the City of Monroe (Butler/Warren County, next to Lemon Township), not Monroe Township in Adams County.",
     "publisher": "WLWT",
     "quote": "Monroe amended its zoning code last year to prohibit data centers and has opposed a proposed development in neighboring Lemon Township."
    },
    {
     "url": "https://www.foodandwaterwatch.org/2026/03/09/monroe-township-oh-unanimously-passes-data-center-moratorium/",
     "source_type": "news",
     "supports": "Monroe Township (Adams County) trustees passed a 12-month moratorium in early March 2026.",
     "publisher": "Food & Water Watch",
     "document_date": "2026-03-09"
    }
   ],
   "notes": "OCJ is misfiled for this row. Its 'Council added data centers as prohibited use in September 2025' is the City of Monroe (a council, next to Lemon Township in Butler County). Monroe Township in Adams County has trustees and had no zoning until 2026. Our 12-month moratorium row is unaffected."
  },
  {
   "moratorium_id": "oh-paris-township-union-county-2026",
   "outcome": "confirmed_unchanged",
   "confidence": 0.55,
   "evidence": [
    {
     "url": "https://www.lucplanning.com/_files/ugd/540e57_498de8a70159455bb287c85b57fe1b6e.pdf",
     "source_type": "ordinance",
     "supports": "Paris Township (Union County) zoning resolution restated for amendments adopted 2026-04-07 (recorded 2026-05-07) adds a 'Data Center' definition but lists it in no district.",
     "publisher": "Paris Township, Union County (via LUC Regional Planning Commission)",
     "document_date": "2026-04-07",
     "quote": "This version: Amended and restated to reflect amendments adopted April 7, 2026."
    },
    {
     "url": "https://marysvillematters.substack.com/p/paris-twp-adopts-1-year-data-center",
     "source_type": "news",
     "supports": "Paris Township adopted a one-year data center moratorium (reported 2026-02-06).",
     "publisher": "Marysville Matters",
     "document_date": "2026-02-06"
    }
   ],
   "notes": "OCJ describes a different instrument: the 2026-04-07 zoning amendment that defines data centers without permitting them (an effective prohibition, which the row's current_status already notes). No record was found that the trustees lifted or ended the February one-year moratorium, so it is not recorded as 'replaced' and remains nominally in force to about February 2027. If trustee minutes later show the moratorium was ended on adoption of the April amendment, change the status to 'replaced'. Caution for later passes: paris-township.com is Paris Township in PORTAGE County (its minutes cite Shalersville and Portage County Regional Planning), and paristwp.com is Paris Township in STARK County. Neither is this row."
  },
  {
   "moratorium_id": "oh-urbana-2026",
   "outcome": "corrected",
   "confidence": 0.8,
   "changes": {
    "outcome": {
     "from": "Moratorium plus a city Data Center Moratorium Committee study. Council later rezoned the site (June 2026). Litigation is pending.",
     "to": "Moratorium plus a city Data Center Moratorium Committee study. On 2026-06-16 council unanimously passed Ordinance 4635-26, restoring the pre-2025 zoning text so data centers are no longer a permitted use in the M-1 Light Manufacturing District. The moratorium was not repealed. Litigation is pending, and a charter amendment banning data centers over 7.5 MW is on the November 2026 ballot.",
     "reason": "The row said council 'rezoned the site'; Peak of Ohio reports a text reversal (Ord. 4635-26) removing data centers as a permitted M-1 use, with no repeal of the moratorium."
    }
   },
   "evidence": [
    {
     "url": "https://www.peakofohio.com/local-news/urbana-city-council-reverses-data-center-zoning-change/",
     "source_type": "news",
     "supports": "Ordinance 4635-26 (2026-06-16) reversed the 2025 amendment that allowed data centers in M-1.",
     "publisher": "Peak of Ohio",
     "quote": "Council unanimously approved Ordinance 4635-26, restoring the city's zoning code to the version that existed before a 2025 amendment allowed data centers in Urbana's M-1 Light Manufacturing District."
    },
    {
     "url": "https://www.peakofohio.com/local-news/court-grants-thor-equities-request-in-urbana-data-center-case/",
     "source_type": "news",
     "supports": "Thor's appeal of the site plan rejection and 12-month moratorium is still being briefed; the project stays on hold.",
     "publisher": "Peak of Ohio"
    },
    {
     "url": "https://www.wyso.org/news/2026-03-04/urbana-passes-moratorium-on-new-data-centers-leaving-1b-proposal-in-limbo",
     "source_type": "news",
     "supports": "12-month moratorium adopted 2026-03-03.",
     "publisher": "WYSO",
     "document_date": "2026-03-04"
    }
   ],
   "notes": "interconnectedcapital overstates this. Ord. 4635-26 removes data centers as a permitted M-1 use; it is not a permanent citywide ban (that is the November ballot charter amendment). It is also a separate instrument from our moratorium, which was not repealed and runs to about 2027-03-03. Status stays active; only the outcome text is corrected."
  }
 ]
}