{
  "state_abbrev": "MT",
  "researched_as_of": "2026-09-23",
  "researcher": "claude-sonnet-5 agent",
  "decisions": [],
  "new_candidates": [
    {
      "state": "Montana",
      "jurisdiction": "Butte-Silver Bow",
      "jurisdiction_type": "County",
      "date_enacted": "",
      "date_enacted_iso": "",
      "date_enacted_uncertainty": "unverified",
      "duration": "As proposed (not yet adopted): a six-month moratorium on data center construction, with up to two additional one-year extensions available, after which the Council of Commissioners would be required to enact permanent regulations. At its 2026-09-02 meeting, the Butte-Silver Bow Council of Commissioners voted 11-0 to direct the county attorney to prepare a temporary moratorium/interim zoning ordinance draft; no draft ordinance had been brought back for a final adoption vote as of 2026-09-23.",
      "duration_days": null,
      "duration_kind": "unknown",
      "current_end_date_iso": "",
      "legal_basis": "Council of Commissioners motion (introduced by Commissioner Michele Shea) directing the county attorney to prepare a temporary data-center moratorium ordinance; adopted 11-0 on 2026-09-02. No ordinance number exists because the moratorium itself has not yet been adopted.",
      "trigger": "Ongoing local debate over data center development, including a separately litigated local ballot initiative (406 People First / Local Initiative 00-02) to require voter approval of data centers, a pending Montana Supreme Court appeal over that initiative's ballot eligibility, and public testimony citing power-supply concerns tied to a still-pending Montana Public Service Commission large-load tariff proceeding.",
      "trigger_categories": [
        "regulatory_gap",
        "grid_energy",
        "legal_or_litigation",
        "land_use_compatibility"
      ],
      "sectors": [
        "data_center"
      ],
      "current_status": "Pending as of 2026-09-23. The Butte-Silver Bow Council of Commissioners voted 11-0 on 2026-09-02 to have the county attorney prepare a temporary data center moratorium, intended to give officials and the public more time to evaluate infrastructure, economic, environmental, and quality-of-life impacts before any new data center development proceeds. No draft ordinance had returned to the Council for final adoption as of this pass. Separately, a district court ruled against a citizens' group (406 People First) that sued the county clerk over rejected signatures for a data-center ballot initiative; that ruling is being appealed to the Montana Supreme Court, which has temporarily allowed the initiative to remain alive pending appeal (a related report indicated the initiative was ultimately kept off the November 2026 ballot).",
      "enacted_status": "pending",
      "affected_projects": "News coverage references a company exploring potential data center sites in Silver Bow County (behind the ballot-initiative and moratorium debate), but no specific named project or MW figure was located in captured sources.",
      "outcome": "Council of Commissioners voted 11-0 to direct the county attorney to draft a temporary data center moratorium ordinance; not yet adopted as of this pass.",
      "confidence": 0.6,
      "evidence": [
        {
          "url": "https://www.kbzk.com/news/butte-silver-bow-county-commission-votes-to-pursue-temporary-moratorium-on-data-centers",
          "title": "Butte-Silver Bow County Commission votes to pursue temporary moratorium on data centers",
          "publisher": "KBZK",
          "document_date": "2026-09",
          "source_type": "news",
          "supports": "Confirms the September 2, 2026 11-0 vote directing the county attorney to prepare a temporary data center moratorium, commissioner and public testimony, and the separate, related ballot-initiative litigation.",
          "quote": "Butte councilwoman Michele Shea introduced a motion for a temporary moratorium on data centers in Butte-Silver Bow County. Saying it would give the council and the public more time to consider all the information on data centers. The motion passed 11-0. ... The Butte-Silver Bow County Commission voted in favor of allowing the county attorney to prepare a temporary moratorium on data center development, as debate over the industry's future in the community continues on multiple fronts."
        },
        {
          "url": "https://www.montanarightnow.com/butte/butte-commissioners-discuss-possibility-of-data-center-moratorium/article_1275f5cc-1531-42b3-8149-045a7e1509d5.html",
          "title": "Butte commissioners discuss possibility of data center moratorium",
          "publisher": "MontanaRightNow (KXLF)",
          "document_date": "2026-08",
          "source_type": "news",
          "supports": "Earlier report establishing the moratorium proposal was under active consideration by the Council of Commissioners in the weeks before the September 2 vote, and specifying the proposed term (six months, with up to two one-year extensions) and that a draft zoning ordinance was due from the County Attorney.",
          "quote": "If approved, the moratorium would last for six months, with a maximum of two 1-year extensions, after which the Council of Commissioners would be required to enact regulations. ... As of last Wednesday, the Butte-Silver Bow Council of Commissioners are considering a proposal that would impose a moratorium, preventing the construction of any new data centers until further discussion is had."
        }
      ],
      "notes": "No jurisdiction disambiguation needed; Butte-Silver Bow (a consolidated city-county government) is not currently in the Montana inventory. A follow-up search for adoption of a final ordinance ('Butte-Silver Bow data center moratorium ordinance adopted') as of 2026-09-23 found only continued coverage of the September 2 direction-to-draft vote and the related ballot-initiative litigation (nbcmontana.com reported the initiative was kept off the November 2026 ballot by a judge's ruling, separate from the moratorium-drafting process), with no report of a final moratorium ordinance vote; the coordinator should re-check closer to any anticipated fall/winter Council of Commissioners meeting."
    }
  ]
}
